{
  "$schema": "./bench/schemas/benchmark-manifest.schema.json",
  "schema_version": 2,
  "benchmark": {
    "name": "RelayBench",
    "version": "0.1.0-h4-phase-zero-freeze-candidate",
    "role": "Execution, parity-audit, deterministic aggregation, and reporting layer beneath Richard Tang's Proofpress long-horizon research plan",
    "result_status": "NO_BENCHMARK_RESULTS"
  },
  "proofpress_integration": {
    "base_commit": "10ee8c4c9a6d56dfedf563a0679e6a5bb167fa0a",
    "branch": "relaybench/h4-phase-zero",
    "stacked_on_unmerged_pr": 22,
    "richard_plan_files_modified": false,
    "proofpress_engine_modified": false
  },
  "canonical_research_plan": {
    "repository": "https://github.com/chenmingtang830/proofpress",
    "pull_request": 22,
    "pull_request_url": "https://github.com/chenmingtang830/proofpress/pull/22",
    "head_commit": "10ee8c4c9a6d56dfedf563a0679e6a5bb167fa0a",
    "artifacts": [
      {
        "path": "studies/LONG_HORIZON_EVAL_RESEARCH_PLAN.md",
        "sha256": "8189dfd932cd98b28aa1bc6728b3e4543520ebba2821a36acf3ad1c709a7dec2"
      },
      {
        "path": "studies/LONG_HORIZON_EVAL_FLOW.md",
        "sha256": "41acdf04bb8bc33a7e5fbd87dfa713c0b733c793b40264f0d43c64a8a51b4dab"
      }
    ],
    "status": "PROPOSED_RESEARCH_PLAN_NO_RESULTS"
  },
  "freeze_status": {
    "manifest_status": "FROZEN_CANDIDATE_REQUIRES_RICHARD_TOMMY_APPROVAL",
    "test_double_mechanics_ready": true,
    "scientific_freeze_approved": false,
    "real_run_ready": false,
    "decision_count": 12,
    "decision_register": [
      {
        "id": "FR-01",
        "field": "study.objective_and_claim_boundary",
        "classification": "Defined by Richard's plan",
        "status": "RESOLVED",
        "resolution": "Version-bound admitted decision/evidence continuity, not legal intelligence."
      },
      {
        "id": "FR-02",
        "field": "horizon.structure",
        "classification": "Defined by Richard's plan",
        "status": "RESOLVED",
        "resolution": "H4; four stages; one session boundary; no branch merge."
      },
      {
        "id": "FR-03",
        "field": "conditions.primary_comparison",
        "classification": "Defined by Richard's plan",
        "status": "RESOLVED",
        "resolution": "C2 Proofpress versus C1 ordinary portable workspace."
      },
      {
        "id": "FR-04",
        "field": "stress_track_separation",
        "classification": "Defined by Richard's plan",
        "status": "RESOLVED",
        "resolution": "Clean continuity, evolving negotiation state, and integrity faults remain separate; only evolving state is active here."
      },
      {
        "id": "FR-05",
        "field": "cold_boundary.process_mechanics",
        "classification": "Safe implementation detail",
        "status": "RESOLVED",
        "resolution": "Fresh child process and empty workspace before S3; sender process exited and source workspace removed."
      },
      {
        "id": "FR-06",
        "field": "information_parity.machine_projection",
        "classification": "Safe implementation detail",
        "status": "RESOLVED",
        "resolution": "Complete common-file byte equality plus enumerated C2-only bindings carrier; human semantic audit still required."
      },
      {
        "id": "FR-07",
        "field": "upstream.source_revision_pins",
        "classification": "Requires Richard/Tommy approval",
        "status": "BLOCKED",
        "recommended_default": "Proofpress PR head 10ee8c4, engine base a5e5ea5, Harvey LAB 7be41d5; use these review-time public revisions unless approval selects another pin."
      },
      {
        "id": "FR-08",
        "field": "candidate_matter.selection",
        "classification": "Requires Richard/Tommy approval",
        "status": "BLOCKED",
        "recommended_default": "Harvey LAB MSA playbook-escalation scenario-01 because it has seven consequential issues, explicit authority limits, varied documents, evolving negotiations, and 72 final criteria."
      },
      {
        "id": "FR-09",
        "field": "h4.release_schedule_and_intermediate_rubrics",
        "classification": "Requires Richard/Tommy approval",
        "status": "BLOCKED",
        "recommended_default": "Use the four-stage document release in candidate.json and the proposed stage criteria in proposed-intermediate-rubrics.json; retain the upstream 72 criteria only for the final deliverable."
      },
      {
        "id": "FR-10",
        "field": "c1.native_session_and_memory_facilities",
        "classification": "Requires Richard/Tommy approval",
        "status": "BLOCKED",
        "recommended_default": "Allow ordinary files and readable handoff state only across the registered cold boundary; no hidden session, transcript, or cross-worker memory in either arm."
      },
      {
        "id": "FR-11",
        "field": "model.provider_route_resolved_identity_reasoning_sampling_tools_and_cost_telemetry",
        "classification": "Provider-dependent",
        "status": "BLOCKED",
        "recommended_default": "Select and qualify one no-fallback route later; do not select a provider/model during Phase Zero mechanics calibration."
      },
      {
        "id": "FR-12",
        "field": "formal_timeout_retry_budget_repeat_analysis_and_later_tracks",
        "classification": "Deferred beyond H4 calibration",
        "status": "DEFERRED",
        "recommended_default": "Preregister after calibration review; do not run C0, clean/integrity expansion, H8+, or the 72-run pilot in this phase."
      }
    ]
  },
  "upstream_proofpress": {
    "repository": "https://github.com/chenmingtang830/proofpress",
    "engine_candidate_commit": "a5e5ea5e3174c2c51982ea36537cef362a973ce5",
    "package_version_at_candidate_commit": "0.3.0",
    "cli_sha256": "66a5bc498f0b5792ee54decec882f471e36c9067e5c8a39365d1e751866a5f6d",
    "engine_modified": false,
    "formal_runtime_checkout": null
  },
  "harvey_lab": {
    "repository": "https://github.com/harveyai/harvey-labs",
    "candidate_commit": "7be41d57fd5a6e97b5f246a029e810f83d09cd96",
    "source_manifest": "bench/fixtures/h4-msa-escalation-candidate/HARVEY_SOURCE_MANIFEST.json",
    "runtime_checkout": null,
    "filesystem_first_harness_required": true,
    "existing_evaluator_required_for_final_legal_quality": true,
    "composed_episode_label": "Proofpress long-horizon extension using version-pinned Harvey LAB materials; not an official Harvey LAB score"
  },
  "candidate_matter": {
    "id": "harvey-msa-playbook-escalation-scenario-01",
    "status": "REQUIRES_RICHARD_TOMMY_APPROVAL",
    "definition": "bench/fixtures/h4-msa-escalation-candidate/candidate.json",
    "source_manifest": "bench/fixtures/h4-msa-escalation-candidate/HARVEY_SOURCE_MANIFEST.json",
    "proposed_intermediate_rubric": "bench/fixtures/h4-msa-escalation-candidate/proposed-intermediate-rubrics.json",
    "test_double_fixture": "bench/fixtures/h4-msa-escalation-candidate/test-double",
    "test_double_is_harvey_content": false
  },
  "scope": {
    "phase": "PHASE_ZERO",
    "horizon": "H4",
    "stress_track": "EVOLVING_NEGOTIATION_STATE",
    "conditions": [
      "C1_ORDINARY_PORTABLE",
      "C2_PROOFPRESS"
    ],
    "real_model_calls": false,
    "paid_calls": false,
    "pilot_runs": false
  },
  "conditions": [
    {
      "id": "C1_ORDINARY_PORTABLE",
      "definition": "bench/conditions/c1-ordinary-portable.json",
      "verifier_required": false
    },
    {
      "id": "C2_PROOFPRESS",
      "definition": "bench/conditions/c2-proofpress.json",
      "verifier_required": true
    }
  ],
  "horizon": {
    "id": "H4",
    "stages": 4,
    "cold_boundaries": 1,
    "branch_merges": 0,
    "stage_schedule": [
      {
        "stage_id": "S1",
        "cold_boundary_before": false,
        "release_file": "bench/fixtures/h4-msa-escalation-candidate/test-double/releases/S1.json"
      },
      {
        "stage_id": "S2",
        "cold_boundary_before": false,
        "release_file": "bench/fixtures/h4-msa-escalation-candidate/test-double/releases/S2.json"
      },
      {
        "stage_id": "S3",
        "cold_boundary_before": true,
        "release_file": "bench/fixtures/h4-msa-escalation-candidate/test-double/releases/S3.json"
      },
      {
        "stage_id": "S4",
        "cold_boundary_before": false,
        "release_file": "bench/fixtures/h4-msa-escalation-candidate/test-double/releases/S4.json"
      }
    ]
  },
  "information_parity": {
    "implementation": "bench/parity/information-parity.mjs",
    "common_substantive_files": "byte-identical",
    "allowed_c2_only_paths": [
      "proofpress/portable-carrier.test-only.json"
    ],
    "verifier_evidence_is_affordance_not_substance": true,
    "human_semantic_audit_required_before_real_calls": true
  },
  "cold_boundary": {
    "before_stage": "S3",
    "fresh_os_process": true,
    "fresh_empty_workspace": true,
    "sender_process_must_exit": true,
    "sender_workspace_must_be_removed_before_receiver_invocation": true,
    "prohibited_transfer_state": [
      ".git",
      ".proofpress",
      "sender ledger",
      "session",
      "transcript",
      "conversation",
      "hidden memory",
      "orchestrator state"
    ]
  },
  "model": {
    "provider": null,
    "route": null,
    "resolved_model": null,
    "reasoning_effort": null,
    "temperature": {
      "supported": null,
      "value": null
    },
    "seed": {
      "supported": null,
      "value": null
    },
    "provider_fallback": false,
    "cross_provider_retries": false
  },
  "execution": {
    "test_only_adapter": "deterministic-test",
    "real_adapter_attached": false,
    "timeout_ms": null,
    "max_attempts": null,
    "retry_on": null,
    "network_for_test_double": false
  },
  "run_plan": {
    "test_only_paired_replicates": 1,
    "real_repeats": null,
    "real_calls_authorized": false
  },
  "scorer": {
    "type": "deterministic_aggregation",